{
  "name": "Post",
  "table": "posts",
  "fields": {
    "id":           { "type": "uuid",        "primary_key": true, "default": "gen_random_uuid()" },
    "slug":         { "type": "string",      "max_length": 200, "unique": true },
    "title":        { "type": "string",      "max_length": 200 },
    "body":         { "type": "text" },
    "author_id":    { "type": "uuid",        "references": { "model": "Author", "field": "id", "on_delete": "restrict" } },
    "published_at": { "type": "timestamptz", "nullable": true },
    "created_at":   { "type": "timestamptz", "default": "now()" },
    "updated_at":   { "type": "timestamptz", "default": "now()" }
  },
  "indexes": [
    { "fields": ["published_at"] },
    { "fields": ["author_id"] }
  ]
}
